<?xml version="1.0" encoding="utf-8" standalone="no"?>
<?thomas-michel document-status="draft" version="1.3"?>
<!DOCTYPE rezept SYSTEM "../../rezepte.dtd">
<?xml-stylesheet href="../../style.xsl" type="text/xsl"?>
<?xml-stylesheet href="../../style.css" type="text/css"?>
<!-- $Id$ -->
<!-- =================================================== -->
<!-- |NudelnMitTomatensosse.xml|  -  TODO description  | -->
<!--                                                     -->
<!-- begin            : | 21.09.2006|                  | -->
<!-- copyright        : | (C) 2006 by tmichel          | -->
<!-- email            : |development@thomas-michel.info| -->
<!-- =================================================== -->
<!--
 ******************************************************************************
 *                                                                            *
 *   This document is a free paper; you can redistribute it and/or modify     *
 *   it under the terms of the GNU Free Documentation License as published    *
 *   by the Free Software Foundation; either version 1.2 of the License, or   *
 *   (at your option) any later version.                                      *
 *                                                                            *
 ******************************************************************************
 -->
<!-- 
 standalone="no" gefordert nach XML in der Praxis S.400 (ISBN 3-8273-1636-7) bei
 :
 + Elementtypen, deren Inhalt weitere Elemente enthält, falls Leerraum (WhiteSpace)
   direkt innerhalb einer Instanz solcher Typen erscheint
 :
 -->
<rezepte>
	<rezept>
		<titel>Gemüsesuppe mit Schweinefleisch</titel>
		<datum>21.10.2006</datum>
		<test>
			<bemerkung>
			Ausreichend für 2 Erwachsene und 4 Kinder.
			</bemerkung>
		</test>
		<produkte>
			<produkt beschreibung="ca. 1 kg Schulter vom Schwein"
					 ean="2260040002527"
					 preis="2,52 €"
			         hersteller="Marktkauf"/>
			<produkt beschreibung="3 mittlere Kohlrabi"/>
			<produkt beschreibung="5 Möhren"/>
			<produkt beschreibung="1 grosse Gemüsezwiebel"/>
			<produkt beschreibung="1 kleine Sellerieknolle"/>
			<produkt beschreibung="1 Stange Porree"/>
			<produkt beschreibung="1 Tüte Lorbeerblätter"/>
			<produkt beschreibung="1 Tüte Gewürznelken"/>
			<produkt beschreibung="1 Tüte Pimentkörner"/>
		</produkte>
		<zutaten>
			<zutat name="Schweinefleich (Schulter)"
				   menge="1"
				   einheit="kg"
				   code="fleisch"/> 
			<zutat name="Kohlrabi"
				   menge="3" 
				   einheit="mittelgrosse"
				   code="kohlrabi"/>
			<zutat name="Möhren" 
					menge="5" 
					code="möhren"/>		
			<zutat name="Gemüsezwiebel" 
					menge="1" 
					code="zwiebel"/>
			<zutat name="Sellerie" 
					menge="1"
					einheit="kleine Knolle"
					code="sellerie"/>	
			<zutat name="Porree" 
					menge="1" 
					einheit="Stange"
					code="porree"/>	
			<zutat name="Salz" 
					menge="nach Bedarf"
					code="salz"/>		
			<zutat name="Lorbeerblätter"
				   menge="2"
				   code="lorbeerblätter"/>															   
			<zutat name="Gewürznelken"
				   menge="2"
				   code="gewürznelken"/>															   
			<zutat name="Pimentkörner"
				   menge="4"
				   code="pimentkörner"/>															   
			<zutat name="Petersilie"
				   menge="1"
				   einheit="Bund"
				   code="petersilie"/>															   

		</zutaten>
		<beilagen>
			<beilage>
			Als Nachtisch eignet sich Obst oder Salat.
			</beilage>
		</beilagen>
		<zubereitung>
			<aktion>
			Schweinefleisch waschen und salzen.
			</aktion>
			<aktion>
			Das Fleisch in einen großen Suppentopf mit Wasser zum kochen 
			aufsetzen (E-Herd Stufe III).
			Die Wassermenge richtet sich nach der benötigten Suppenmenge. Sollte
			aber so etwa bei 2? Litern liegen. Auf jeden Fall muss das Fleich 
			vollständig bedeckt sein.
			</aktion>
			<aktion>
			<zutatref code="lorbeerblätter">Lorbeerblätter</zutatref>, 
			<zutatref code="gewürznelken">Nelken</zutatref>,
			<zutatref code="pimentkörner">Pimentkörner</zutatref> sowie
			2 Messerspitzen <zutatref code="salz">Salz</zutatref>
			in den Topf geben.
			</aktion> 
			<aktion>
			Fleisch kurz aufkochen lassen und dann 1h auf kleiner Flamme 
			weiter kochen lassen (E-Herd Stufe 1).
			</aktion>
			<aktion>
			In der Zwischenzeit das Gemüse waschen, putzen, schälen und schneiden.
			So dass Kohlrabi und Zwiebel in kleine Würfel, Möhren und Porree 
			in kleine Ringe und der Sellerie in kleinen Scheiben vorliegt. Die 
			Petersilie wird einfach klein gehächselt wie bei Kräutern üblich.
			</aktion>
			<aktion>
			Nachdem das Fleisch 1h gekocht hat, wird wieder auf grosse Flamme 
			(E-Herd Stufe II) geschalten bis sich das Fleisch vom Knochen 
			zu lösen beginnt.
			</aktion>
			<aktion>
			Fleisch aus dem Topf nehmen und den Rest auf kleiner Flamme weiter 
			kochen lassen. Sämtliches Fleisch und Fett vom Knochen lösen, 
			klein schneiden und in den Topf zurückgeben.
			Besonders große Knochen (bei Schulter sollte einer dabei sein) können
			wieder in den Topf gelegt werden um weiteres Mark auszukochen.
			</aktion>
			<aktion>
			Gleich dannach die Kohlrabi und Möhrenstücken und den Sellerie in
			den Topf geben.
			</aktion>
			<aktion>
			Nach 30 Minuten die Zwiebel und den Porree zur Suppe geben.
			</aktion>
			<aktion>
			Nach weiteren 15 Minuten die Petersilie hinzufügen.
			</aktion>
			<aktion>
			Noch ca. 15 Minuten kochen lassen bis alles weich ist und servieren.
			Die Gesamtkochzeit beträgt etwa 2h.
			</aktion>
			
		</zubereitung>
		<tipps>
			<tipp>
				Durch Zugabe von Instant Suppenpulver (Maggi) kann die Suppe 
				je nach Geschmackswunsch verändert werden.
			</tipp>
			<tipp>
				Fleisch und Fett bei Kindern besonders kleinschneiden, sonst
				wird es aussortiert.
			</tipp>
			<tipp>
				Es ist erstrebenswert das Gemüse und vor allem die Gewürze so
				kurz wie möglich im Topf zu kochen, damit noch ein paar 
				Nährstoffe und Vitamine erhalten bleiben.
			</tipp>
			<tipp>
				Bei Bedarf ist es besser das Gericht neu aufzuwärmen als es über
				länger Zeit warm zu halten.
			</tipp>
		</tipps>
	</rezept>
</rezepte>
